{
  "schemaVersion": "1.0.0",
  "evidenceKind": "deterministic-mock",
  "receiptId": "467429ab688c02a8931d68078a189ce30c0354e91d0f4405c9c760823699bc08",
  "contract": {
    "platform": "ios",
    "device": "mock-ios-latest",
    "osVersion": "mock-latest",
    "osRole": "latest",
    "deviceClass": "configured-ios",
    "buildSha": "547f5f87a8cea7696135f611a42e2dcdcaebd9f5f",
    "sourceHead": "547f5f87a8cea7696135f611a42e2dcdcaebd9f5f",
    "appId": "mock.ios",
    "version": "1.0.0-mock",
    "signingFingerprint": "abababababababababababababababababababababababababababababababab",
    "testRunId": "mock-run-ios-latest",
    "slot": "ios-latest"
  },
  "device": {
    "physical": false,
    "virtual": true,
    "browser": false,
    "providerName": "deterministic-mock",
    "providerRunId": "mock-provider-ios-latest",
    "deviceIdentifierHash": "77f64a3fd050c696c54ee0b7716b9d588b61ce10b46f9fedf067289ba883a3de",
    "model": "non-device-fixture"
  },
  "run": {
    "completedAt": "2026-09-01T00:00:00.000Z",
    "status": "passed",
    "fixtureVersion": "mock-v1"
  },
  "flowHash": "0b763d6ea992dd2c55a53b942c1d8af69bd4d8a3913b9099394a17f14f06f10b",
  "flows": [
    {
      "id": "fresh-install-login",
      "status": "passed",
      "durationMs": 0,
      "error": null
    },
    {
      "id": "identity-boundary",
      "status": "passed",
      "durationMs": 0,
      "error": null
    },
    {
      "id": "agent-switch",
      "status": "passed",
      "durationMs": 0,
      "error": null
    },
    {
      "id": "text-chat-queue",
      "status": "passed",
      "durationMs": 0,
      "error": null
    },
    {
      "id": "attachments",
      "status": "passed",
      "durationMs": 0,
      "error": null
    },
    {
      "id": "share-intent",
      "status": "passed",
      "durationMs": 0,
      "error": null
    },
    {
      "id": "interaction-zone",
      "status": "passed",
      "durationMs": 0,
      "error": null
    },
    {
      "id": "lifecycle-recovery",
      "status": "passed",
      "durationMs": 0,
      "error": null
    },
    {
      "id": "artifacts",
      "status": "passed",
      "durationMs": 0,
      "error": null
    },
    {
      "id": "permission-deny",
      "status": "passed",
      "durationMs": 0,
      "error": null
    },
    {
      "id": "upgrade-pending",
      "status": "passed",
      "durationMs": 0,
      "error": null
    }
  ],
  "artifacts": {
    "junit": {
      "path": "junit.xml",
      "sha256": "e2fb4544a51b09e500aa62fcbc7a264bc4f1930c978cad2e6c7fb4f225ca729e"
    },
    "screenshots": {
      "path": "screenshots.json",
      "count": 0
    },
    "limitedLog": {
      "path": "maestro.sanitized.txt",
      "bytes": 52,
      "truncated": false
    }
  },
  "integrity": {
    "algorithm": "HMAC-SHA256",
    "payloadSha256": "54e042ec57aed0bd82ea84edfcefb5bc66229e0b0cfe31342acd42592fe5cf19",
    "hmacSha256": "e52eff10df934668536b833529ea7c0f009f09bb6cb6caf72aa0c856a6532ade"
  }
}
